551a,V3,Tanz-Capricen No.1 (Einleitung und Coda zu Raffs Walzer),pf,D? major,1854,"Piano, transcr.","additional introduction and coda to No.1 of the Tanz-Capricen, Op.54, by Joachim Raff"
552,A54,Ouverture de l'opéra Guillaume Tell de Gioachino Rossini,pf,,1838,"Piano, transcr.","arr. of the overture from the opera Guillaume Tell, Rossini"
552a,—,Caritas (nach Rossini),pf,,1847,"Piano, transcr.","arr. of No.3 of 3 Chœurs religieux by Gioachino Rossini; incomplete sketch as S.701j; 1st version of S.552b, S.553/2; originally intended for S.172a"
552b,—,La caritá (d'après Rossini),pf,,1847,"Piano, transcr.","2nd (simplified) version of S.552a, S.553/2; originally intended for S.172a"
553,A141,Transcriptions d'après Rossini (2):,pf,,1847,"Piano, transcr.",
553/1,A141/1,Air du Stabat Mater,pf,,1847,"Piano, transcr.","arr. of ""Cujus animam"" from Stabat Mater by Gioachino Rossini; arr. for bn org as S.679; for ten org as S.682"
553/2,A141/2,La charité,pf,,1847,"Piano, transcr.","arr. of No.3 of 3 Chœurs religieux by Gioachino Rossini; 3rd version of S.552a, S.552b"
554/1,A304,O! Wenn es doch immer so bliebe! (Lied von Anton Rubinstein),pf,,1881,"Piano, transcr.","arr. of No.9 of 12 Lieder des Mirza-Schaffy, Op.34 by Anton Rubinstein"
554/2,A329,Der Asra (Lied von Anton Rubinstein),pf,,1880,"Piano, transcr.","arr. of No.6 of 6 Lieder von Heine, Op.32 by Anton Rubinstein"
554a,V5,Étude sur des notes fausses (Einleitung und Coda zu Anton Rubinsteins Etude),pf,C major,1880?,"Piano, transcr.",revisions and additions to Etude on False Notes by Anton Rubinstein
555,A273,Danse macabre (Poème symphonique de Camille Saint-Saëns),pf,,1876,"Piano, transcr.","arr. of the symphonic poem Danse macabre, Op.40 by Camille Saint-Saëns"
556/1,A17,Die Rose (Lied von Franz Schubert),pf,,1833,"Piano, transcr.","arr. of the song Die Rose, D.745 by Franz Schubert; 1st version of S.556/2, S.556/3"
556/2,A17,Die Rose (Lied von Franz Schubert),pf,,1838,"Piano, transcr.","2nd version of S.556/1, S.556/3"
556/3,A17,Die Rose (Lied von Franz Schubert),pf,,1837,"Piano, transcr.","3rd version of S.556/1, S.556/2"
557,A45,Lob der Tränen (Lied von Franz Schubert),pf,,1838,"Piano, transcr.","arr. of the song Lob der Tränen, D.711 by Franz Schubert"
557a,A42/4,Erlkönig (Lied von Franz Schubert),pf,,1837,"Piano, transcr.","arr. of the song Erlkönig, D.328 by Franz Schubert; 1st version of S.558/4, S.558/4bis"
557b,A42/5,Meeresstille (Lied von Franz Schubert),pf,,1837,"Piano, transcr.","arr. of the song Meeres Stille, D.216 by Franz Schubert; 1st version of S.558/5"
557c,A42/7,Frühlingsglaube (Lied von Franz Schubert),pf,,1837,"Piano, transcr.","arr. of the song Frühlingsglaube, D.686 by Franz Schubert; 1st version of S.558/7, S.558/7bis"
557d,A42/12,Ave Maria (Lied von Franz Schubert),pf,,1837,"Piano, transcr.","arr. of the song Ave maria, D.839 by Franz Schubert; 1st version of S.558/12"
558,A42,Lieder von Franz Schubert (12):,pf,,1837–38,"Piano, transcr.",
558/1,A42/1,Sei mir gegrüßt (Sois toujours mes seuls amours),pf,,1837–38,"Piano, transcr.","arr. of the song Sei mir gegrüsst, D.741 by Franz Schubert"
558/2,A42/2,Auf dem Wasser zu singen (Barcarolle),pf,,1837–38,"Piano, transcr.","arr. of the song Auf dem Wasser zu singen, D.774 by Franz Schubert"
558/3,A42/3,Du bist die Ruh' (L'attente),pf,,1837–38,"Piano, transcr.","arr. of the song Du bist die Ruh, D.776 by Franz Schubert; 1st version of S.558/3bis"
558/3bis,A42/3,Du bist die Ruh' (L'attente),pf,,1876,"Piano, transcr.",2nd version of S.558/3
558/4,A42/4,Erlkönig (Le roi des Aulnes),pf,,1837–38,"Piano, transcr.","arr. of the song Erlkönig, D.328 by Franz Schubert; 2nd version of S.557a, S.558/4bis"
558/4bis,A42/4,Erlkönig (Le roi des Aulnes),pf,,1876,"Piano, transcr.","3rd version of S.557a, S.558/4"
558/5,A42/5,Meeresstille (La mer calme),pf,,1837–38,"Piano, transcr.","arr. of the song Meeres Stille, D.216 by Franz Schubert; 2nd version of S.557b"
558/6,A42/6,Die junge Nonne (La jeune r éligieuse),pf,,1837–38,"Piano, transcr.","arr. of the song Die junge Nonne, D.828 by Franz Schubert"
558/7,A42/7,Frühlingsglaube (Espoir dans le printemps),pf,,1837–38,"Piano, transcr.","arr. of the song Frühlingsglaube, D.686 by Franz Schubert; 2nd version of S.557c, S.558/7bis"
558/7bis,A42/7,Frühlingsglaube (Espoir dans le printemps),pf,,1876,"Piano, transcr.","3rd version of S.557c, S.558/7"
558/8,A42/8,Gretchen am Spinnrade (Marguerite),pf,,1837–38,"Piano, transcr.","arr. of the song Gretchen am Spinnrade, D.118 by Franz Schubert; 1st version of S.558/8bis"
558/8bis,A42/8,Gretchen am Spinnrade (Marguerite),pf,,1876,"Piano, transcr.",2nd version of S.558/8
558/9,A42/9,Ständchen von Shakespeare (La sérénade de Shakspeare),pf,,1837–38,"Piano, transcr.","arr. of the song Ständchen, D.889 by Franz Schubert; 1st version of S.558/9bis"
558/9bis,A42/9,Ständchen von Shakespeare (La sérénade de Shakspeare),pf,,1876,"Piano, transcr.",2nd version of S.558/9
558/10,A42/10,Rastlose Liebe,pf,,1837–38,"Piano, transcr.","arr. of the song Rastlose Liebe, D.138 by Franz Schubert"
558/11,A42/11,Der Wanderer (Le pèlerin),pf,,1837–38,"Piano, transcr.","arr. of the song Der Wanderer, D.493 by Franz Schubert; 1st version of S.558/11bis"
558/11bis,A42/11,Der Wanderer (Le pèlerin),pf,,1876,"Piano, transcr.",2nd version of S.558/11
558/12,A42/12,Ave Maria,pf,,1837–38,"Piano, transcr.","arr. of the song Ave Maria, D.839 by Franz Schubert; 2nd version of S.557d"
559,A46,Gondelfahrer (Männerquartett von Franz Schubert),pf,,1838,"Piano, transcr.","arr. of the chorus Gondelfahrer, D.809 by Franz Schubert"
559a,A49/7,La sérénade de Franz Schubert,pf,,1837,"Piano, transcr.","arr. of No.4 of the song cycle Schwanengesang, D.957 by Franz Schubert; 1st version of S.560/7, S.560/7a"
560,A49,Schwanengesang (Lieder von Franz Schubert),pf,,1838–39,"Piano, transcr.","arr. of the song cycle Schwanengesang, D.957 by Franz Schubert"
560/1,A49/1,Die Stadt,pf,,1838–39,"Piano, transcr.","arr. of No.11 of the song cycle Schwanengesang, D.957 by Franz Schubert"
560/2,A49/2,Das Fischermädchen,pf,,1838–39,"Piano, transcr.","arr. of No.10 of the song cycle Schwanengesang, D.957 by Franz Schubert"
560/3,A49/3,Aufenthalt,pf,,1838,"Piano, transcr.","arr. of No.5 of the song cycle Schwanengesang, D.957 by Franz Schubert"
560/4,A49/4,Am Meer,pf,,1838–39,"Piano, transcr.","arr. of No.12 of the song cycle Schwanengesang, D.957 by Franz Schubert"
560/5,A49/5,Abschied,pf,,1838–39,"Piano, transcr.","arr. of No.7 of the song cycle Schwanengesang, D.957 by Franz Schubert"
560/6,A49/6,In der Ferne,pf,,1838–39,"Piano, transcr.","arr. of No.6 of the song cycle Schwanengesang, D.957 by Franz Schubert"
560/7,A49/7,Ständchen,pf,,1838,"Piano, transcr.","arr. of No.4 of the song cycle Schwanengesang, D.957 by Franz Schubert; 2nd version of S.559a, S.560/7a"
560/7a,A49/7,Ständchen,pf,,1880,"Piano, transcr.","3rd version of S.559a, S.560/7"
560/8,A49/8,Ihr Bild,pf,,1838–39,"Piano, transcr.","arr. of No.9 of the song cycle Schwanengesang, D.957 by Franz Schubert"
560/9,A49/9,Frühlingssehnsucht,pf,,1838–39,"Piano, transcr.","arr. of No.3 of the song cycle Schwanengesang, D.957 by Franz Schubert"
560/10,A49/10,Liebesbotschaft,pf,,1838–39,"Piano, transcr.","arr. of No.1 of the song cycle Schwanengesang, D.957 by Franz Schubert"
560/11,A49/11,Der Atlas,pf,,1838–39,"Piano, transcr.","arr. of No.8 of the song cycle Schwanengesang, D.957 by Franz Schubert"
560/12,A49/12,Der Doppelgänger,pf,,1838–39,"Piano, transcr.","arr. of No.13 of the song cycle Schwanengesang, D.957 by Franz Schubert"
560/13,A49/13,Die Taubenpost,pf,,1838–39,"Piano, transcr.","arr. of No.14 of the song cycle Schwanengesang, D.957 by Franz Schubert"
560/14,A49/14,Kriegers Ahnung,pf,,1838–39,"Piano, transcr.","arr. of No.2 of the song cycle Schwanengesang, D.957 by Franz Schubert"
561,A50,Winterreise (12 Lieder von Franz Schubert),pf,,1839,"Piano, transcr.","arr. of 12 songs from the cycle Winterreise, D.911 by Franz Schubert"
561/1,A50/1,Gute Nacht,pf,,1839,"Piano, transcr.","arr. of No.1 from the cycle Winterreise, D.911 by Franz Schubert"
561/2,A50/2,Die Nebensonnen,pf,,1839,"Piano, transcr.","arr. of No.23 from the cycle Winterreise, D.911 by Franz Schubert"
561/3,A50/3,Mut!,pf,,1839,"Piano, transcr.","arr. of No.22 from the cycle Winterreise, D.911 by Franz Schubert"
561/4,A50/4,Die Post,pf,,1839,"Piano, transcr.","arr. of No.13 from the cycle Winterreise, D.911 by Franz Schubert"
561/5,A50/5,Erstarrung,pf,,1839,"Piano, transcr.","arr. of No.4 from the cycle Winterreise, D.911 by Franz Schubert"
561/6,A50/6,Wasserflut,pf,,1839,"Piano, transcr.","arr. of No.6 from the cycle Winterreise, D.911 by Franz Schubert"
561/7,A50/7,Der Lindenbaum,pf,,1839,"Piano, transcr.","arr. of No.5 from the cycle Winterreise, D.911 by Franz Schubert"
561/8,A50/8,Der Leiermann,pf,,1839,"Piano, transcr.","arr. of No.24 from the cycle Winterreise, D.911 by Franz Schubert"
561/9,A50/9,Täuschung,pf,,1839,"Piano, transcr.","arr. of No.19 from the cycle Winterreise, D.911 by Franz Schubert"
561/10,A50/10,Das Wirtshaus,pf,,1839,"Piano, transcr.","arr. of No.21 from the cycle Winterreise, D.911 by Franz Schubert"
561/11,A50/11,Der stürmische Morgen,pf,,1839,"Piano, transcr.","arr. of No.18 from the cycle Winterreise, D.911 by Franz Schubert"
561/12,A50/12,Im Dorfe,pf,,1839,"Piano, transcr.","arr. of No.17 from the cycle Winterreise, D.911 by Franz Schubert"
562,A73,Franz Schuberts geistliche Lieder,pf,,1840,"Piano, transcr.",vol. 2 of Konzerttranskriptionen über 10 geistliche Lieder von Beethoven und Schubert
562/1,A73/1,Litaney,pf,,1840,"Piano, transcr.","arr. of the song Am Tage Aller Seelen, D.343 by Franz Schubert"
562/2,A73/2,Himmelsfunken,pf,,1840,"Piano, transcr.","arr. of the song Himmelsfunken, D.651 by Franz Schubert"
562/3,A73/3,Die Gestirne,pf,,1840,"Piano, transcr.","arr. of the song Die Gestirne, D.444 by Franz Schubert"
562/4,A73/4,Hymne,pf,,1840,"Piano, transcr.","arr. of No.4 from the incidental music to Rosamunde, D.797 by Franz Schubert"
563,A109,Melodien von Franz Schubert (6):,pf,,1844,"Piano, transcr.",
563/1,A109/1,Lebe wohl!,pf,,1844,"Piano, transcr.",
563/2,A109/2,Mädchens Klage,pf,,1844,"Piano, transcr.","arr. of the song Des Mädchens Klage, D.191 by Franz Schubert"
563/3,A109/3,Das Sterbeglöcklein,pf,,1844,"Piano, transcr.","arr. of the song Das Zügenglöcklein, D.871 by Franz Schubert"
563/4,A109/4,Trockne Blumen,pf,,1844,"Piano, transcr.","arr. of No.18 from the song cycle Die schöne Müllerin, D.795 by Franz Schubert"
563/5,A109/5,Ungeduld,pf,,1844,"Piano, transcr.","arr. of No.7 from the song cycle Die schöne Müllerin, D.795 by Franz Schubert; 1st version of S.565/6, S.565bis/6"
563/6,A109/6,Die Forelle,pf,,1844,"Piano, transcr.","arr. of the song Die Forelle, D.550 by Franz Schubert; 1st version of S.564"
564,A127,Die Forelle (Lied von Franz Schubert),pf,,1846,"Piano, transcr.","arr. of the song Die Forelle, D.550 by Franz Schubert; 2nd version of S.563/6"
565,A128,Müllerlieder von Franz Schubert,pf,,1846,"Piano, transcr.",1st version of S.565bis
565/1,A128/1,Das Wandern,pf,,1846,"Piano, transcr.","arr. of No.1 from the song cycle Die schöne Müllerin, D.795 by Franz Schubert; 1st version of S.565bis/1"
565/2,A128/2,Der Müller und der Bach,pf,,1846,"Piano, transcr.","arr. of No.19 from the song cycle Die schöne Müllerin, D.795 by Franz Schubert; 1st version of S.565bis/2"
565/3,A128/3,Der Jäger,pf,,1846,"Piano, transcr.","arr. of No.14 from the song cycle Die schöne Müllerin, D.795 by Franz Schubert; 1st version of S.565bis/3"
565/4,A128/4,Die böse Farbe,pf,,1846,"Piano, transcr.","arr. of No.17 from the song cycle Die schöne Müllerin, D.795 by Franz Schubert; 1st version of S.565bis/4"
565/5,A128/5,Wohin?,pf,,1846,"Piano, transcr.","arr. of No.2 from the song cycle Die schöne Müllerin, D.795 by Franz Schubert; 1st version of S.565bis/5"
565/6,A128/6,Ungeduld,pf,,1846,"Piano, transcr.","arr. of No.7 from the song cycle Die schöne Müllerin, D.795 by Franz Schubert; 2nd version of S.563/5, S.565bis/6"
565bis,A128,Müllerlieder von Franz Schubert,pf,,1879,"Piano, transcr.",2nd (simplified) version of S.565
565bis/1,A128/1,Das Wandern,pf,,1879,"Piano, transcr.","arr. of No.1 from the song cycle Die schöne Müllerin, D.795 by Franz Schubert; 2nd version of S.565/1"
565bis/2,A128/2,Der Müller und der Bach,pf,,1879,"Piano, transcr.","arr. of No.19 from the song cycle Die schöne Müllerin, D.795 by Franz Schubert; 2nd version of S.565/2"
565bis/3,A128/3,Der Jäger,pf,,1879,"Piano, transcr.","arr. of No.14 from the song cycle Die schöne Müllerin, D.795 by Franz Schubert; 2nd version of S.565/3"
565bis/4,A128/4,Die böse Farbe,pf,,1879,"Piano, transcr.","arr. of No.17 from the song cycle Die schöne Müllerin, D.795 by Franz Schubert; 2nd version of S.565/4"
565bis/5,A128/5,Wohin?,pf,,1879,"Piano, transcr.","arr. of No.2 from the song cycle Die schöne Müllerin, D.795 by Franz Schubert; 2nd version of S.565/5"
565bis/6,A128/6,Ungeduld,pf,,1879,"Piano, transcr.","arr. of No.7 from the song cycle Die schöne Müllerin, D.795 by Franz Schubert; 2nd version of S.563/5, S.565/6"
565a,U14/1,Grosse Fantasie von Franz Schubert,pf,C major,1868,"Piano, transcr.","edited with additions to the Fantasie in C major, D.760 by Franz Schubert"
565b,U14/2,Impromptus von F. Schubert (4),pf,,1868,"Piano, transcr.","edited, with additions to Nos.2 and 3 of Impromptus, D.899 by Franz Schubert"
566,A133,Liebeslied (Widmung von Robert Schumann),pf,,1848,"Piano, transcr.","arr. of No.1 of Myrthen, Op.25 by Robert Schumann; 1st version of S.566a"
566a,A133,Liebeslied (Widmung von Robert Schumann),pf,,1850-59?,"Piano, transcr.",2nd version of S.566
567,A212,Lieder von Robert Schumann,pf,,1861,"Piano, transcr.",
567/1,A212/1,An den Sonnenschein,pf,,1861,"Piano, transcr.","arr. of No.4 of 6 Gedichte, Op.36 by Robert Schumann"
567/2,A212/2,Rotes Röslein,pf,,1861,"Piano, transcr.","arr. of No.2 of Lieder und Gesänge, Vol.I, Op.27 by Robert Schumann"
568,A257,Frühlingsnacht (Lied von Robert Schumann),pf,,1872,"Piano, transcr.",arr. of No.12 of Liederkreis by Robert Schumann
569,A264a,Lieder von Robert und Clara Schumann (10):,pf,,1874,"Piano, transcr.",
569/1,A264a/1,Weihnachtslied,pf,,1874,"Piano, transcr.","arr. of No.16 of Liederalbum für die Jugend, Op.79 by Robert Schumann"
569/2,A264a/2,Die wandelnde Glocke,pf,,1874,"Piano, transcr.","arr. of No.17 of Liederalbum für die Jugend, Op.79 by Robert Schumann"
569/3,A264a/3,Frühlings Ankunft,pf,,1874,"Piano, transcr.","arr. of No.19 of Liederalbum für die Jugend, Op.79 by Robert Schumann"
569/4,A264a/4,Des Sennen Abschied,pf,,1874,"Piano, transcr.","arr. of No.22 of Liederalbum für die Jugend, Op.79 by Robert Schumann"
569/5,A264a/5,Er ist's,pf,,1874,"Piano, transcr.","arr. of No.23 of Liederalbum für die Jugend, Op.79 by Robert Schumann"
569/6,A264a/6,Nur wer die Sehnsucht kennt,pf,,1874,"Piano, transcr.","arr. of No.3 of Lieder und Gesänge aus Wilhelm Meister, Op.98a by Schumann"
569/7,A264a/7,An die Türen will ich schleichen,pf,,1874,"Piano, transcr.","arr. of No.5 of 'Lieder und Gesänge aus Wilhelm Meister, Op.98a by Schumann"
569/8,A264b/1,Warum willst du and're fragen,pf,,1874,"Piano, transcr.","arr. of No.9 of Gedichte aus Ru?ckerts Liebesfru?hling, Op.12, by Clara Schumann"
569/9,A264b/2,Ich hab' in deinem Auge,pf,,1874,"Piano, transcr.","arr. of No.5 of 6 Lieder, Op.13, by Clara Schumann"
569/10,A264b/3,Geheimes Flüstern hier und dort,pf,,1874,"Piano, transcr.","arr. of No.10 of 6 Lieder aus Jucunde von Rollet, Op.23, by Clara Schumann"
570,A306,Provenzalisches Minnelied (von Robert Schumann),pf,,1881,"Piano, transcr.","arr. of No.4 of Des Sängers Fluch, Op.139 by Robert Schumann"
570a,V16,Polka de salon (Einleitung und Coda zu Smetanas Polka),pf,F? major,1885,"Piano, transcr.","additions and revisions to No.1 of 3 Polkas de salon, Op.7 by Bed?ich Smetana"
571,A275,Die Rose (Romanze von Louis Spohr),pf,,1876,"Piano, transcr.","arr. of Zemire's romance from the opera Zemire und Azor, by Louis Spohr"
571a,V15,Valse-Caprice No.3 (Einleitung und Schlußtakte zu Tausigs dritter Valse-Caprice),pf,,1880,"Piano, transcr.",additions and revisions to of Valse-Caprice No.3 by Carl Tausig; formerly S.167a
572,A292,Marche hongroise de Szabadi (Revive Szegedin!),pf,,1879,"Piano, transcr.",arr. of the Marche héroïque de Szabadi by Jules Massenet.
573,A258,Einleitung und Ungarischer Marsch von Graf Imre Széchényi (Bevezetés és magyar induló Gróf Széchényi Imrétõl ),pf,,1872,"Piano, transcr.",based on the Ungarischer Marsch by Imre Széchényi
573a,A297,Seconda Mazurka di Tirindelli,pf,,1880,"Piano, transcr.",additions and revisions to Mazurka No.2 by Pier Adolfo Tirindelli
574,A122,Ouvertüre zur Webers Oper Oberon,pf,,1846,"Piano, transcr.","arr. of the overture from the opera Oberon, J.306 by Carl Maria von Weber"
575,A129,Ouvertüre aus Webers Oper Der Freischütz,pf,,1846,"Piano, transcr.","arr. of the overture from the opera Der Freischütz, Op.77 by Carl Maria von Weber"
576,A121,Webers Jubelovertüre,pf,,1846,"Piano, transcr.","arr. of the Jubel-Ouvertüre, Op.59 by Carl Maria von Weber"
576a,—,Konzertstück (von Weber),pf,,1868–70,"Piano, transcr.",arr. of the Konzertstück. Op.79 by Carl Maria von Weber
577/1,A87,I Love (Romanze von Wielhorski),pf,,1842,"Piano, transcr.","arr. of the romance I Love by Mikhail Vielgorsky; 2nd version of S.577/2, S.577bis, and S.577ter"
577/2,A87,Autrefois (Romance du Comte Mikaïl Yourievitch Wielhorsky),pf,,1843,"Piano, transcr.","4th version of S.577/1, S.577bis, and S.577ter"
577bis,—,"Romance ""Lyubila ya""",pf,,1842?,"Piano, transcr.","1st version of S.577ter, S.577/1, and S.577/2"
577ter,—,"Romance ""Lyubila ya""",pf,,1843?,"Piano, transcr.","3rd version of S.577bis, S.577/1, and S.577/2"
577a-634b,,Pianoforte duet,,,,,
577a,T33,12 Nocturnes (John Field),pf4h,,1877,"Piano, 4 hands, arr.",
577a/1,T33/1,Nocturne No.1,pf4h,,1877,"Piano, 4 hands, arr.","arr. of Nocturne No.1 in E? major, H.24, by John Field"
577a/2,T33/2,Nocturne No.2,pf4h,,1877,"Piano, 4 hands, arr.","arr. of Nocturne No.2 in C minor, H.25, by John Field"
577a/3,T33/3,Nocturne No.3,pf4h,,1877,"Piano, 4 hands, arr.","arr. of Nocturne No.3 in A? major, H.26, by John Field"
577a/4,T33/4,Nocturne No.4,pf4h,,1877,"Piano, 4 hands, arr.","arr. of Nocturne No.4 in A major, H.36, by John Field"
577a/5,T33/5,Nocturne No.5,pf4h,,1877,"Piano, 4 hands, arr.","arr. of Nocturne No.5 in B? major, H.37, by John Field"
577a/6,T33/6,Nocturne No.6,pf4h,,1877,"Piano, 4 hands, arr.","arr. of Nocturne No.6 in F major, H.40, by John Field"
577a/7,T33/7,Nocturne No.7,pf4h,,1877,"Piano, 4 hands, arr.","arr. of Pastorale in A major, H.14, by John Field"
577a/8,T33/8,Nocturne No.8,pf4h,,1877,"Piano, 4 hands, arr.","arr. of Romance in E? major, H.30, by John Field"
577a/9,T33/9,Nocturne No.9,pf4h,,1877,"Piano, 4 hands, arr.","arr. of Nocturne No.8 in E minor, H.46, by John Field"
577a/10,T33/10,Nocturne No.10,pf4h,,1877,"Piano, 4 hands, arr.","arr. of Nocturne No.17 in E major, H.65, by John Field"
577a/11,T33/11,Nocturne No.11,pf4h,,1877,"Piano, 4 hands, arr.","arr. of Nocturne No.11 in E? major, H.56, by John Field"
577a/12,T33/12,Nocturne No.12,pf4h,,1877,"Piano, 4 hands, arr.","arr. of Nocturne No.18 in E major (""Midi""), H.13, by John Field"
578,B27,Die Legende von der Heiligen Elisabeth:,pf4h,,1862–66?,"Piano, 4 hands, arr.",arr. from S.2
578/1,B27/1,Orchester Einleitung,pf4h,,1862–66?,"Piano, 4 hands, arr.",arr. of Introduction from S.2
578/2,B27/2,Marsch der Kreuzritter,pf4h,,1862–66?,"Piano, 4 hands, arr.",arr. of No.3e from S.2
578/3,B27/3,Der Sturm,pf4h,,1862–66?,"Piano, 4 hands, arr.",arr. of No.4d from S.2
578/4,B27/4,Interludium,pf4h,,1862–66?,"Piano, 4 hands, arr.",arr. of No.6a from S.2
579,B30,Orchestersätze aus dem Oratorium Christus (2):,pf4h,,1866–73?,"Piano, 4 hands, arr.",arr. from S.3
579/1,B30/1,Hirtengespiel an der Krippe,pf4h,,1866–73?,"Piano, 4 hands, arr.",arr. of No.4 from S.3
579/2,B30/2,Die heiligen drei Könige,pf4h,,1866–73?,"Piano, 4 hands, arr.",arr. of No.5 from S.3
580,B42,Excelsior! (Preludio zu dem Glocken des Strassburger Münsters),pf4h,,1874,"Piano, 4 hands, arr.",arr. of prelude from S.6
581,B31,Aus der Ungarischen Krönungsmesse,pf4h,,1869,"Piano, 4 hands, arr.",arr. from S.11
581/1,B31/1,Benedictus,pf4h,,1869,"Piano, 4 hands, arr.",arr. of No.5 from S.11
581/2,B31/2,Offertorium,pf4h,,1869,"Piano, 4 hands, arr.",arr. of No.7 from S.11
582,B53,O Lamm Gottes!,pf4h,,1878-79,"Piano, 4 hands, arr.",arr. of S.504b/7
583,B52,Via Crucis (Les 14 stations de la croix),pf4h,,1878–79,"Piano, 4 hands, arr.",arr. of S.53
584,B6,Fest-Cantate für die Inaugurations-Feier des Beethoven-Denkmals in Bonn,pf4h,,1845,"Piano, 4 hands, arr.",arr. of S.67
585,B24,Pastorale (Schnitterchor aus dem Entfesselten Prometheus),pf4h,,1861,"Piano, 4 hands, arr.",arr. of No.4 from S.69/2
586,B34,Gaudeamus igitur (Humoreske),pf4h,,1870?,"Piano, 4 hands, arr.",arr. of S.71a
587,B7,Marche héroique,pf4h,,1848?,"Piano, 4 hands, arr.",arr. of S.510
588,B16,Weimars Volkslied,pf4h,,1857,"Piano, 4 hands, arr.",arr. of S.313
589,B37,Ce qu'on entend sur la montagne (Symphonic Poem No.1),pf4h,,1874,"Piano, 4 hands, arr.",arr. of S.95 (3rd version)
590,B20,Tasso: Lamento e Trionfo,pf4h,,1858,"Piano, 4 hands, arr.",arr. of S.96
,,(Symphonic Poem No.2),,,,,
591,B12,Les préludes,pf4h,,1853–58,"Piano, 4 hands, arr.",arr. of S.97
,,(Symphonic Poem No.3),,,,,
592,B17,Orpheus,pf4h,,1858,"Piano, 4 hands, arr.",arr. of S.98
,,(Symphonic Poem No.4),,,,,
593,B18,Prometheus,pf4h,,1858?,"Piano, 4 hands, arr.",arr. of S.99
,,(Symphonic Poem No.5),,,,,
594,B38,Mazeppa,pf4h,,1874,"Piano, 4 hands, arr.",arr. of S.100
,,(Symphonic Poem No.6),,,,,
595,B13,Festklänge,pf4h,,1854–61,"Piano, 4 hands, arr.",arr. of S.101
,,(Symphonic Poem No.7),,,,,
596,B39,Hungaria,pf4h,,1874,"Piano, 4 hands, arr.",arr. of S.103
,,(Symphonic Poem No.9),,,,,
596a,B49,Héroïde funèbre,pf4h,,1877,"Piano, 4 hands, arr.",arr. of S.102
,,(Symphonic Poem No.8),,,,,
596b,B51,Hunnenschlacht,pf4h,,1877,"Piano, 4 hands, arr.",arr. of S.105
,,(Symphonic Poem No.11),,,,,
596c,B44,Die Ideale,pf4h,,1874–77,"Piano, 4 hands, arr.",arr. of S.106 by Liszt and Giovanni Sgambati
,,(Symphonic Poem No.12),,,,,
597,B40,Hamlet,pf4h,,1874,"Piano, 4 hands, arr.",arr. of S.104
,,(Symphonic Poem No.10),,,,,
598,B55,Von der Wiege bis zum Grabe (From the Cradle to the Grave),pf4h,,1881,"Piano, 4 hands, arr.",arr. of S.107
,,(Symphonic Poem No.13),,,,,
599,B15,Episoden aus Lenau's Faust (2),pf4h,,1856–61?,"Piano, 4 hands, arr.",arr. of S.110
599/1,B15/1,Der nächtliche Zug,pf4h,,1856–61?,"Piano, 4 hands, arr.",arr. of S.110/1
599/2,B15/2,Der Tanz in der Dorfschenke (Mephisto Waltz),pf4h,,1856–61?,"Piano, 4 hands, arr.",arr. of S.110/2
600,B54,Mephisto Waltz No.2,pf4h,,1880–81,"Piano, 4 hands, arr.",arr. of S.515
—,B23,Odes funèbres (3):,pf4h,,1860–69,"Piano, 4 hands, arr.",arr. from S.112
601,B23/1,Les morts,pf4h,,1860,"Piano, 4 hands, arr.",arr. of S.112/1
602,B23/2,La notte,pf4h,,1866,"Piano, 4 hands, arr.",arr. of S.112/2
603,B23/3,Le triomphe funèbre du Tasse,pf4h,,1866–69,"Piano, 4 hands, arr.",arr. of S.112/3
604/1,B28/1,Boze co? Polsk?,pf4h,,1863,"Piano, 4 hands, arr.",arr. of S.113/1
604/2,B28/2,Salve Polonia (Interludium aus dem Oratorium St. Stanislaus),pf4h,,1884,"Piano, 4 hands, arr.",arr. of S.113/2
605,B22,Künstlerfestzug zur Schillerfeier 1859,pf4h,,1859,"Piano, 4 hands, arr.",arr. of S.114
606,B19,Festmarsch zur Goethe-Jubiläumfeier,pf4h,,1858?,"Piano, 4 hands, arr.",arr. of S.115
607,B21,Festmarsch nach Motiven von E.H.z.S.-C.-G.,pf4h,,1858–59,"Piano, 4 hands, arr.",arr. of S.116
608,B33,Rákóczi-Marsch,pf4h,,1870,"Piano, 4 hands, arr.",arr. of S.117
609,B32,Ungarischer Marsch zur Krönungsfeier in Ofen-Pest am 8. Juni 1867,pf4h,,1870,"Piano, 4 hands, arr.",arr. of S.118
610,B46,Ungarischer Sturmmarsch (Hungarian Battle March),pf4h,,1875,"Piano, 4 hands, arr.",arr. of S.119
611,W7,Epithalam (zu Eduard Reményi‘s Vermählungsfeier),pf4h,,1872,"Piano, 4 hands, arr.",arr. of S.129; Liszt's authorship doubtful
612,B36,Elegy No.1,pf4h,,1874,"Piano, 4 hands, arr.",arr. of S.196
612a,B43,Weihnachtsbaum,pf4h,,1875?,"Piano, 4 hands, arr.",arr. of S.185a; 1st version of S.613
612a/1,B43/1,Psallite (Altes Weihnacthen),pf4h,,1875?,"Piano, 4 hands, arr.",arr. of S.185a/1; 1st version of S.613/1
612a/2,B43/2,O heilige Nacht!,pf4h,,1875?,"Piano, 4 hands, arr.",arr. of S.185a/2; 1st version of S.613/2
612a/3,B43/3,"Die Hirten an der Krippe (""In dulci jubilo"")",pf4h,,1875?,"Piano, 4 hands, arr.",arr. of S.185a/3; 1st version of S.613/3
612a/4,B43/4,Adeste fideles (gleichsam als Marsch der heiligen drei Konige),pf4h,,1875?,"Piano, 4 hands, arr.",arr. of S.185a/4; 1st version of S.613/4
612a/5,B43/5,Scherzoso,pf4h,,1875?,"Piano, 4 hands, arr.",arr. of S.185a/5; 1st version of S.613/5
612a/6,B43/6,Reveille-Matin (Wecker),pf4h,,1875?,"Piano, 4 hands, arr.",arr. of S.185a/6; 1st version of S.613/6
612a/7,B43/7,Schlummerlied,pf4h,,1875?,"Piano, 4 hands, arr.",arr. of S.185a/7; 1st version of S.613/7
612a/8,B43/8,(Alt-provenzalisches Noel),pf4h,,1875?,"Piano, 4 hands, arr.",arr. of S.185a/8; 1st version of S.613/8
612a/9,B43/9,(Abendglocken),pf4h,,1875?,"Piano, 4 hands, arr.",arr. of S.185a/9; 1st version of S.613/9
612a/10,B43/10,(Ehemals),pf4h,,1875?,"Piano, 4 hands, arr.",arr. of S.185a/10; 1st version of S.613/10
