1-350,,Original works,,,,,
1,,Opera,,,,,
1,O1,Don Sanche (Le château de l'amour),vv ch orch,,1824–25,Stage,"opera in 1 act; libretto by Théaulon and de Rancé, after a story by Jean-Pierre Claris de Florian; first perf. 1825-10-17 in Paris; unpublished"
24139,,Sacred choral works,,,,,
2,I4,Die Legende von der Heiligen Elisabeth,sop alt 3bar 2bass ch org orch,,1857–62,"Choral, sacred","extracts arr. for pf as S.498a, S.693a; for pf4h as S.578; introduction arr. for org as S.663a"
3,I7,Christus,sop alt ten bar bass ch org orch,,1866–72,"Choral, sacred","Nos.6–8 based on S.25, S.29, S.261; Nos.4 and 5 arr. for pf as S.498b, for pf4h as S.579; No.8 arr. for org as S.664"
42373,I8a,Cantico di San Francesco,bar pf org/harm (+ mch),F major,1862,"Choral, sacred",1st version of S.4/2; Alleluja arr. for org (+ tbn) as S.677
42404,I8b,Cantico del sol di Francesco d'Assisi,bar mch org orch,F major,1879–82,"Choral, sacred","2nd version; arr. for pf as S.499, for org as S.760; Prelude arr. for pf as S.498c, for org as S.665"
42374,I1a,Sainte Cécile (Die heilige Cäcilia),mez orch (?),,1845,"Choral, sacred",1st version of S.5/2 ; lost
42405,I1b,Sainte Cécile (Die heilige Cäcilia),mez orch (+ ch),,1874,"Choral, sacred",2nd version of S.5/1; arr. for mez hp/pf/harm (+ ch)  as S.5/2a
,,(Legende),,,,,
5/2a,I1b,Sainte Cécile (Die heilige Cäcilia),mez hp/pf/harm (+ ch),,1874,"Choral, sacred",arr. of S.5/2
,,(Legende),,,,,
6,L15,Die Glocken des Strassburger Münsters,2vv ch org orch,,1874–75,"Choral, sacred",oratorio; prelude arr. for pf4h as S.580; for pf as S.500; for org (+ ch) as S.666; for v org as S.767 [?]
7,I10,Cantantibus organis (Antiphona in festo Santa Caeciliae),alt ch orch,G major–G minor,1879,"Choral, sacred",
7a,I10,Cantantibus organis (Antiphona in festo Santa Caeciliae),alt ch harm,G major–G minor,1879,"Choral, sacred",
42377,J5a,Missa quattuor vocum ad aequales,mch org,,1846–47,"Choral, sacred",1st version of S.8/2
42408,J5b,Missa quattuor vocum ad aequales (Szekszárd Mass),mch org,,1869,"Choral, sacred",2nd version of S.8/1; themes used in S.264
9,I2,Missa Solennis (Graner Mass),sop alt ten bass ch orch,,1857–58,"Choral, sacred",extract ('Poco adagio') arr. for pf as S.747 [?]
10,J18,"Missa Choral, sacredis",ch org,,1859–65,"Choral, sacred",
11,I9,Ungarische Krönungsmesse (Hungarian Coronation Mass),4vv ch orch,,1866–69,"Choral, sacred","Nos.5 and 7 arr. for pf as S.501, for pf4h as S.581, for vn pf as S.381, for vn org/harm as S.678; No.5 arr. for org as S.667; No.6 arr. for mch pf as S.15a/1, for ch pf as S.15a/2; No.7 arr. for vn orch as S.362"
12,J22,Requiem (Messe des morts),4vv mch org (+ br perc),,1867–71,"Choral, sacred",includes S.45 as No.6; adapted for org as S.266; No.6 arr. for mch org as S.45
42382,I3a,"Psalm 13 (Herr, wie lange willst du meiner so gar vergessen)",4vv ch orch,,1855–56,"Choral, sacred",1st version of S.13/2
42413,I3b,"Psalm 13 (Herr, wie lange willst du meiner so gar vergessen)",ten ch orch,,1859–63,"Choral, sacred",2nd version of S.13/1; arr. for ten ch org as S.132/2a
13/2a,I3b,"Psalm 13 (Herr, wie lange willst du meiner so gar vergessen)",ten ch org,,1866,"Choral, sacred",arr. of S.13/2
42383,I5a,Psalm 18 (Coeli enarrant gloriam Dei / Die Himmel erzählen die Ehre Gottes),mch orch (+ org),,1860,"Choral, sacred","1st version of S.14/2; arr. for mch ww br as S.14/1a, for org as S.667a"
14/1a,I5a,Psalm 18 (Coeli enarrant gloriam Dei / Die Himmel erzählen die Ehre Gottes),mch ww br,,1860,"Choral, sacred",arr. of S.14/1; 1st version of S.14/2a
42414,I5b,Psalm 18 (Coeli enarrant gloriam Dei / Die Himmel erzählen die Ehre Gottes),mch org,,1870,"Choral, sacred",2nd version of S.14/1; arr. for mch ww br as S.14/2a
14/2a,I5b,Psalm 18 (Coeli enarrant gloriam Dei / Die Himmel erzählen die Ehre Gottes),mch ww br,,1870,"Choral, sacred",arr. of S.14/2; 2nd version of S.14/1a
15/1a,J10a,"Psalm 23 (Mein Gott, der ist mein Hirt)",sop/ten mch hp/(pf org)/harm,,1859–61?,"Choral, sacred","1st version of S.15/1b, S.15/2a, S.15/2b, S.15bis"
15/1b,K1,"Psalm 23 (Mein Gott, der ist mein Hirt)",sop/ten hp/(pf org)/harm,,1859–62,"Choral, sacred","2nd version of S.15/1a, S.15/2a, S.15/2b, S.15bis"
15/2a,J10b,"Psalm 23 (Mein Gott, der ist mein Hirt)",sop/ten mch hp/pf,,1859–62,"Choral, sacred","3rd version of S.15/1a, S.15/1b, S.15/2b, S.15bis"
15/2b,I1b,"Psalm 23 (Mein Gott, der ist mein Hirt)",sop/ten hp/pf,,1859–62,"Choral, sacred","4th version of S.15/1a, S.15/1b, S.15/2a, S.15bis"
15bis,S53,"Psalm 23 (Mein Gott, der ist mein Hirt)",ch orch,,1862,"Choral, sacred","5th version of S.15/1a, S.15/1b, S.15/2a, S.15/2b; lost"
15a/1,J6,Psalm 116 (Laudate Dominum),mch pf,,1869–74,"Choral, sacred",arr. of S.11/6
15a/2,J6,Psalm 116 (Laudate Dominum),ch pf,,1869–74,"Choral, sacred",arr. of S.11/6
42385,K6,Psalm 129 (De profundis),bar mch org,,1880–81,"Choral, sacred",originally intended for S.688; 1st version of S.16/2; themes re-used in S.172a/8 and S.173/4
42416,J45,Psalm 129 (De profundis),alt pf/org,,1883,"Choral, sacred",2nd version of S.16/1; themes re-used in S.172a/8 and S.173/4
42386,K2,Psalm 137 (An den Wassern zu Babylon),alt vn hp/pf org/harm,,1859,"Choral, sacred","1st version of S.17/2, S.17/3"
42417,J11,Psalm 137 (An den Wassern zu Babylon),sop fch hp/pf org/harm vn,,1859–62,"Choral, sacred","2nd version of S.17/1, S.17/3"
42446,S54,Psalm 137 (An den Wassern zu Babylon),ch orch,,1862,"Choral, sacred","3rd version of S.17/2, S.17/3; lost"
18,J4,Choruses with French texts (5):,ch,,1846?,"Choral, sacred",
42387,J4/5,Qui m'a donné la naissance,ch,,1846?,"Choral, sacred",incomplete
42418,J4/1,L'Eternel est son nom,ch,,1846?,"Choral, sacred",
42447,J4/2,"Chantons, chantons l'auteur de la lumière",ch,,1846?,"Choral, sacred",
42478,J4/3,"(Allegretto, moderato con grazia)",ch,A major,1846?,"Choral, sacred",possibly same as S.762
42508,J4/4,Combien j'ai douce souvenance,ch,,1846?,"Choral, sacred",based on an Auverge folksong
42388,J2/1,Hymne de l'enfant á son réveil (O père qu'adore mon père),fch pf/harm (+ hp),,1840–44?,"Choral, sacred","based on S.171c; 1st version of S.19/2, S.19/3, S.19/4; lost"
42419,J2/2,Hymne de l'enfant á son réveil (O père qu'adore mon père),ch pf/harm,,1860–62?,"Choral, sacred","2nd version of S.19/1, S.19/3, S.19/4; text in French and Italian"
42448,J2/3,Hymne de l'enfant á son réveil (O père qu'adore mon père),ch pf/harm,,1865,"Choral, sacred","3rd version of S.19/1, S.19/2, S.19/4; text in French and Italian"
42479,J2/4,Hymne de l'enfant à son réveil (O père qu'adore mon père),fch pf/harm (+ hp),,1874,"Choral, sacred","4th version of S.19/1, S.19/2, S.19/3; text in French, German and Hungarian"
42389,J1/1,Ave Maria I,ch (+ org),B? major,1842,"Choral, sacred",1st version of S.20/2; arr. for org as S.667b/1
42420,J1/2,Ave Maria I,ch org,A major,1852,"Choral, sacred",2nd version of S.20/1; arr. for org as S.667b/2
42390,J3/1,Pater noster I,mch,,1846,"Choral, sacred","based on S.172a/6; 1st version of S.21/2; sometimes ""Pater noster II"" in older listings"
42421,J3/2,Pater noster I,mch,,1852,"Choral, sacred",2nd version of S.21/1
22,J52,Pater noster IV,ch org,C major,1850?,"Choral, sacred",
23,J8,Domine salvum fac regem (Psalm 20),ten mch org,,1853,"Choral, sacred",
24,J7,Te Deum I,mch org,,1853?,"Choral, sacred","sometimes ""Te Deum II"" in older listings"
25,J9,Die Seligkeiten (Les béatitudes),bar ch (+ org),,1859,"Choral, sacred",rev. as S.3/6
26,M33,Festgesang zur Eröffnung der zehnten allgemeinen deutschen Lehrerversammlung (Wir bau’n und bestellen das edelste Feld),mch (+ org),,1858,"Choral, sacred",
27,J12,Te Deum II,mch org (+ br perc),,1867,"Choral, sacred","sometimes ""Te Deum I"" in older listings"
28,J13,An den heiligen Franziskus von Paula (Gebet),2ten 2bass mch org/harm (+3 tbn timp),,1860–74?,"Choral, sacred",based on S.175/2
29,J14,Pater noster II (Das Vater unser),ch org,A? major,1860,"Choral, sacred",rev. as S.3/7
30,J20,Responsorien und Antiphonen (Répons et Antiennes),ch (+ org),,1860,"Choral, sacred",
42400,J15a/1,Christus ist geboren I (Weihnachtslied I),ch org,,1863,"Choral, sacred",1st version of S.31/2
31/2,J15a/2,Christus ist geboren I (Weihnachtslied I),mch org,,1863,"Choral, sacred",2nd version of S.31/1
32/1,J15b/1,Christus ist geboren II (Weihnachtslied II),ch org/harm,,1863,"Choral, sacred","1st version of S.32/2, S.32/3; arr. for pf as S.502"
32/2,J15b/2,Christus ist geboren II (Weihnachtslied II),mch (+ org),,1863,"Choral, sacred","2nd version of S.32/1, S.32/3"
32/3,J15c,Christus ist geboren II (Weihnachtslied II),fch,,1863,"Choral, sacred","3rd version of S.32/1, S.32/2"
33,J16,"Slavimo slavno, Slaveni!",mch org,,1863–66,"Choral, sacred","arr. for pf as S.503, for org as S.668"
34/1,J19/1,Ave maris stella,ch org,G major,1865–66,"Choral, sacred",1st version of S.34/2
34/2,J19/2,Ave maris stella,mch org,B? major,1868,"Choral, sacred","2nd version of S.34/1; arr. for v pf/harm as S.680, for pf as S.506, for harm as S.669/2a, for org/harm as S.669/2b"
35/1,J17a,Crux! (Hymne des marins avec Antienne approbative de Notre Tout Saint Père Pie IX),mch,,1865,"Choral, sacred",1st version of S.35/2
35/2,J17b,Crux! (Hymne des marins avec Antienne approbative de Notre Tout Saint Père Pie IX),fch/cch pf,,1865,"Choral, sacred",2nd version of S.35/1
36,J21,Dall' alma Roma,2vv (+ org),,1867–68,"Choral, sacred",based on S.261
37,J23,Mihi autem adhaerere (Offertoire de la messe du patriarche séraphique San François),mch org,,1868,"Choral, sacred",
38,J24,Ave Maria II,ch org,D major,1869,"Choral, sacred","arr. for harm as S.667c, for v org/harm as S.681, for pf as S.504/1 and S.504/2"
39/1,J25a,Inno a Maria Vergine,ch hp org,,1869,"Choral, sacred",1st version of S.39/2
39/2,J25b,Inno a Maria Vergine,ch hp pf4h org/ham,,1869,"Choral, sacred",2nd version of S.39/1
40,J28,O salutaris hostia I,fch org,,1869,"Choral, sacred",
41/1,J26/1,Pater noster III,ch pf/org,F major,1869,"Choral, sacred",1st version of S.41/2
41/2,J26/2,Pater noster III,mch pf/org/harm,B? major,1869,"Choral, sacred",2nd version of S.41/1
42/1,J27/1,Tantum ergo,fch org,,1869,"Choral, sacred",1st version of S.42/2
42/2,J27/2,Tantum ergo,mch org,,1869,"Choral, sacred",2nd version of S.42/3
43,J29,O salutaris hostia II,ch (+ org),E major,1870,"Choral, sacred",
44,J31,Ave verum corpus,ch (+ org),,1871,"Choral, sacred",
45,J30,Libera me,mch org,,1871,"Choral, sacred",arr. of S.12/6
46/1,J32/1,Anima Christi sanctifica me,mch org,,1874,"Choral, sacred",1st version of S.46/1
46/2,J32/2,Anima Christi sanctifica me,mch org,,1874,"Choral, sacred",2nd version of S.46/2
47,J41,Sankt Christoph (Legend),fch pf harm (+ hp),,1881,"Choral, sacred",unpublished
48,I6,Der Herr bewahret die Seelen seiner Heiligen,ch br timp org,,1860–75?,"Choral, sacred",
49,J42,O heilige Nacht (Weihnachtslied),ten fch org/harm,,1881,"Choral, sacred",based on S.186/2
49a,—,Adeste fidelis,fch,, ?,"Choral, sacred",incomplete
50,A286b,Alte deutsche geistliche Weisen,ch kbd,,1878–79,"Choral, sacred","probably misattributed to Liszt, who arr. the pieces as S.504b and S.669a"
50/1,A286b/8,Es segne uns Gott,ch kbd,,1878–79,"Choral, sacred","arr. for pf as S.504b/3a, for ch org as S.669a/1"
50/2,A286b/4,Meine Seel' erhebt den Herrn (Gott sei gnädig und barmherzig),ch kbd,,1878–79,"Choral, sacred","arr. for pf as S.504b/3, for v ch/org as S.669a/2, for ch org as S.51"
50/3,A286b/3,Nun ruhen alle Wälder,ch kbd,,1878–79,"Choral, sacred","arr. for pf as S.504b/5, for v org as S.669a/3"
50/4,A286b/5,O Haupt voll Blut und Wunden,ch kbd,,1878–79,"Choral, sacred","arr. for pf as S.504b/6, for v org as S.669a/4"
50/5,A286b/6,O Lamm Gottes!,ch kbd,,1878–79,"Choral, sacred","arr. for pf as S.504b/7, for v pf/org as S.669a/5"
50/6,A286b/1,"Was Gott tut, das ist wohlgetan",ch kbd,,1878–79,"Choral, sacred","arr. for pf as S.504b/10, for v org as S.669a/6"
50/7,A286b/7,Wer nur den lieben Gott läßt walten,ch kbd,,1878–79,"Choral, sacred","arr. for pf as S.504b/11, for v org as S.669a/7"
50/8,A286b/9,Vexilla Regis,ch kbd,,1878–79,"Choral, sacred",arr. for pf as S.504b/9
50/9,A286b/10,Crux ave benedicta,ch kbd,,1878–79,"Choral, sacred",arr. for pf as S.504b/1
50/10,A286b/2,O Traurigkeit,ch kbd,,1878–79,"Choral, sacred",arr. for pf as S.504b/8
50/11,A286b/12,Nun danket alle Gott!,ch kbd,,1878–79,"Choral, sacred",arr. for pf as S.504b/4
50/12,A286b/11,Jesu Christe (Die fünf Wunden),ch kbd,,1878–79,"Choral, sacred",arr. for pf as S.504b/2
51,J34,Meine Seel' erhebt den Herrn! (Gott sei uns gnädig und barmherzig) (Der Kirchensegen),ch org,,1878,"Choral, sacred",arr. of S.50/2
52,J35,Septem sacramenta,mez bar ch org/harm,,1878–84,"Choral, sacred",
53,J33,Via Crucis (Les 14 stations de la croix),vv ch pf/org/harm,,1876–79,"Choral, sacred","arr. for org as S.669b, for pf4h as S.583, for pf as S.504"
54,J36,O Roma nobilis,ch org,,1878–79,"Choral, sacred","based on a chorus by Giuseppe Baini; Liszt's authorship of Choral, sacred parts doubtful; see also arrs. for org as S.669c, for pf as S.506b"
55,J38,Ossa arida,ch org4h,,1879,"Choral, sacred",
56,J37,Rosario,ch org/harm (+ bar),,1879,"Choral, sacred",
56/1,J37/1,Mysteria gaudiosa,ch org/harm,,1879,"Choral, sacred",arr. for org/harm as S.670/1
56/2,J37/2,Mysteria dolorosa,ch org/harm,,1879,"Choral, sacred",arr. for org/harm as S.670/2
56/3,J37/3,Mysteria gloriosa,ch org/harm,,1879,"Choral, sacred",arr. for org/harm as S.670/3
56/4,J37/4,Pater noster,bar/mch org/harm,,1879,"Choral, sacred",
57,J46,In domum Domini ibimus,ch br perc org,,1884,"Choral, sacred","arr. for pf as S.505, for org as S.671"
58,J40,O sacrum convivium,alt fch org/harm,,1880–85,"Choral, sacred",arr. for org/harm as S.674a
59,J39,Pro Papa,ch org,,1880,"Choral, sacred",
59/1,J39/1,Tu es Petrus,mch org,,1880,"Choral, sacred",
59/2,J39/2,Dominus conservet eum,ch org,,1880,"Choral, sacred",
60,J44,Ave Maria III (Sposalizio),alt fch org/harm,,1883,"Choral, sacred","based on S.161/1; arr. for org/harm as S.671a, for v 2pf as S.700g"
61,J43,Nun danket alle Gott,ch/mch 2tpt 3tbn timp org,,1883,"Choral, sacred",arr. for org as S.674c
62,J47,Mariengarten,ch org (+ alt ten),,1884?,"Choral, sacred",
63,J48,Qui seminant in lacrimis,ch org,,1883,"Choral, sacred",
64,J49,Pax vobiscum!,mch (+ org),,1885,"Choral, sacred",
65,J50,Qui Mariam absolvisti,bar ch org/harm,,1885,"Choral, sacred",
66,J51,Salve Regina,ch,,1885,"Choral, sacred",
67-94,,Secular choral works,,,,,
67,L1,Festkantate zur Enthüllung des Beethoven-Denkmals in Bonn (Was versammelt hier die Menge),6vv orch,,1845,"Choral, secular",arr. for pf4h as S.584; extracts arr. for pf in S.507
,,(Beethoven Cantata No.1),,,,,
68,L12,Zur Säcularfeier Beethovens,4vv ch orch,,1869–70,"Choral, secular",
,,(Beethoven Cantata No.2),,,,,
69/1,L8/1,Chöre zu Herders Entfesseltem Prometheus,sop alt 2ten 2bass ch orch,,1850,"Choral, secular","1st version of S.69/2, S.69/3; No.4 arr. for pf as S.507a (incomplete); No.5 arr. for pf as S.692e (unfinished); overture rev. as S.99"
69/2,L8/2,Chöre zu Herders Entfesseltem Prometheus,sop alt 2ten 2bass 2ch orch,,1855–59,"Choral, secular","2nd version of S.69/1, S.69/3; No.4 arr. for pf as S.508, for pf4h as S.585"
69/3,L8/3,Chöre zu Herders Entfesseltem Prometheus,sop alt 2ten 2bass 2ch orch,,1877?,"Choral, secular","3rd version of S.69/1, S.69/2"
70/1,L9/1,An die Künstler,4vv mch ww br,,1853,"Choral, secular","instrumentation by Joachim Raff; 1st version of S.70/2, S.70/3"
70/2,L9/2,An die Künstler,4vv mch orch,,1853–54,"Choral, secular","2nd version of S.70/1, S.70/3"
70/3,L9/3,An die Künstler,4vv mch org orch,,1856–57,"Choral, secular","3rd version of S.70/1, S.70/2; themes used in S.114"
71a,L11/1,Gaudeamus igitur (Humoreske),orch,,1869–70,Orchestral,"1st version of S.71b, S.71c; arr. for pf as S.509; for pf4h as S.586"
71b,L11/2,Gaudeamus igitur (Humoreske),mch orch,,1869–70,"Choral, secular","2nd version of S.71a, S.71c"
71c,L11/3,Gaudeamus igitur (Humoreske),ch orch,,1869–70,"Choral, secular","3rd version of S.71a, S.71b"
72,,Vierstimmige Männergesänge (4):,mch pf,,1841–42,"Choral, secular",
72/1a,M2/1,Rheinweinlied (Wo solch ein Feuer),mch pf,,1841,"Choral, secular",1st version
72/1b,M2/2,Rheinweinlied (Wo solch ein Feuer),mch pf,,1884,"Choral, secular",2nd version
72/2,M3,Studentenlied aus Goethe's Faust (Es lebt’ eine Ratt im Kellernest),mch,,1841–42,"Choral, secular",
72/3,M4,Reiterlied I (Die bange Nacht ist nun herum),mch,B? major,1841–42,"Choral, secular",for alternative setting see S.72/4
72/4,M5,Reiterlied II (Die bange Nacht ist nun herum),mch,C major,1841–42,"Choral, secular",for alternative setting see S.72/3
73,M19,Es war einmal ein König (Flohlied),bar/bass mch pf,,1844–45,"Choral, secular",
74/1,M1,Das deutsche Vaterland I (Was ist das deutsche Vaterland?),4vv mch pf,D major,1841,"Choral, secular",1st version of S.74/2
74/2,M27,Das deutsche Vaterland II (Was ist das deutsche Vaterland?),mch,C major,1848,"Choral, secular",2nd version of S.74/1
75/1,M12/1,Über allen Gipfeln ist Ruh’ (Wanderers Nachtlied),mch,,1842,"Choral, secular","No.3 of Vierstimmige Männergesänge; 1st version of S.75/2, S.75/3"
75/2,M12/2,Über allen Gipfeln ist Ruh’ (Wanderers Nachtlied),mch,,1849,"Choral, secular","2nd version of S.75/1, S.75/3"
75/3,M12/3,Über allen Gipfeln ist Ruh’ (Wanderers Nachtlied),mch 2hn,,1856,"Choral, secular","3rd version of S.75/1, S.75/2"
76,M11,Das düstre Meer umrauscht mich,mch pf,,1842,"Choral, secular",No.2 of Vierstimmige Männergesänge
76a,M15,Heil! Unsrer Glocke heil,mch pf,,1843,"Choral, secular",
77,M26,Die lustige Legion,mch (+ pf),,1846?,"Choral, secular",
78,M17,"Trinkspruch (Giesst Wein in die Gläser, ihr Zecher!)",mch pf,,1843–44,"Choral, secular",No.1 of Sechs Männerchöre
79/1,M14/2,Titan (Auf des Athos blauen Felsenspitzen),bar mch pf,,1842–47,"Choral, secular",2nd version of S.700j; arr. for bar mch orch as S.79/2
79/2,L4,Titan (Auf des Athos blauen Felsenspitzen),bar mch orch,,1848,"Choral, secular",arr. of S.79/1
80a,M20,Les quatre éléments,mch pf/pf4h,,1844–45,"Choral, secular",arr. for mch orch by Liszt and August Conradi as S.80b
80a/1,M20/1,La terre,mch pf,,1844–45,"Choral, secular",arr. for mch orch by Liszt and August Conradi as S.80b/1
80a/2,M20/2,Les aquilons,mch pf4h,,1844,"Choral, secular",arr. for mch orch by Liszt and August Conradi as S.80b/2
80a/3,M20/3,Les flots,mch pf,,1845,"Choral, secular",arr. for mch orch by Liszt and August Conradi as S.80b/3
80a/4,M20/4,Les astres,mch pf,,1845?,"Choral, secular",arr. for mch orch by Liszt and August Conradi as S.80b/4
80b,L2,Les quatre éléments,mch orch,,1844–48,"Choral, secular",arr. of S.80a by Liszt and August Conradi; sketches for overture rev. as S.97
80b/1,L2/1,La terre,mch orch,,1844–48,"Choral, secular",arr. of S.80a/1 by Liszt and August Conradi
80b/2,L2/2,Les aquilons,mch orch,,1844–48,"Choral, secular",arr. of S.80a/2 by Liszt and August Conradi
80b/3,L2/3,Les flots,mch orch,,1845–48,"Choral, secular",arr. of S.80a/3 by Liszt and August Conradi
80b/4,L2/4,Les astres,mch orch,,1845–48,"Choral, secular",arr. of S.80a/4 by Liszt and August Conradi
81/1,M21,"Le forgeron (Le fer est dur, frappons, frappons)",2vv mch pf,,1845,"Choral, secular",arr. for 2vv mch orch by Liszt and August Conradi as S.81/2
81/2,L3,"Le forgeron (Le fer est dur, frappons, frappons)",2vv mch orch,,1845–48,"Choral, secular",arr. of S.81/1 by Liszt and August Conradi
81a,M25,A patakhoz (A patakcsa),mch,,1846,"Choral, secular",
82,M16,"Arbeiterchor (Herbei, herbei, den Spath’ und Schaufel ziert)",bar mch pf,,1843–48?,"Choral, secular",arr. for pf as S.510; arr. for pf4h as S.587
83a,L5,Ungaria-Kantate (Aus Osten aus der Sonne Tor),vv mch pf,,1842–48?,"Choral, secular",arr. for vv mch orch by Liszt and August Conradi as S.83b
83b,L5,Ungaria-Kantate (Aus Osten aus der Sonne Tor),vv mch orch,,1848,"Choral, secular",arr. of S.83a by Liszt and August Conradi
84/1,M28/1,"Licht, mehr Licht",mch 3tbn tba,,1849,"Choral, secular",1st version of S.84/2
84/2,M28/2,"Licht, mehr Licht",mch 2tpt 3tbn,,1856,"Choral, secular",2nd version of S.84/1
85/1,M29/1,"Chor der Engel aus Goethe's Faust II (Rosen, ihr blendenden)",mch pf,,1849,"Choral, secular","1st version of S.85/2, S.85/3"
85/2,M29/2,"Chor der Engel aus Goethe's Faust II (Rosen, ihr blendenden)",fch hp pf/harm,,1849,"Choral, secular","2nd version of S.85/1, S.85/3"
85/3,L7,"Chor der Engel aus Goethe's Faust II (Rosen, ihr blendenden)",ch hp/pf,,1849,"Choral, secular","3rd version of S.85/1, S.85/2"
86a,M30,Festchor zur Enthüllung des Herder-Denkmals in Weimar,mch pf,,1850,"Choral, secular",arr. for mch br as S.86b
86b,M30,Festchor zur Enthüllung des Herder-Denkmals in Weimar,mch br,,1850,"Choral, secular",arr. of S.86a
87/1a,L10a,Weimars Volkslied (Von der Wartburg),mch ww br perc,E major,1857,"Choral, secular",arr. of S.313; 1st version of S.87/1bis; arr. for mch pf as S.87/1b
87/1b,M32a,Weimars Volkslied (Von der Wartburg),mch pf,E major,"1857, rev. 1875?","Choral, secular",arr. of S.87/1a
87/1bis,L10a,Weimars Volkslied (Von der Wartburg),mch ww br perc,E major,1875?,"Choral, secular",2nd version of S.87/1a
87/2,M32b,Weimars Volkslied (Von der Wartburg),mch (+ pf),F major,1857?,"Choral, secular",arr. of S.313
87/3a,M32c/1,Weimars Volkslied (Von der Wartburg),mch,E major,1860?,"Choral, secular",arr. of S.313; 1st version of S.87/3b
87/3b,M32c/2,Weimars Volkslied (Von der Wartburg),mch,E major,1875?,"Choral, secular",2nd version of S.87/3a; not published
87/4,M32d,Weimars Volkslied (Von der Wartburg),mch org,E major,1875,"Choral, secular",arr. of S.313
87/5,M32e,Weimars Volkslied (Von der Wartburg),mch (+ pf),E major,1875,"Choral, secular",byarr. of S.313 [by Bernhard Sulze ?]
87/6,M32f,Weimars Volkslied (Von der Wartburg),uch,E major,1875?,"Choral, secular",arr. of S.313
87/7,M32g,Weimars Volkslied (Von der Wartburg),cch,F major,1875?,"Choral, secular",arr. of S.313
87/8a,L10b/1,Weimars Volkslied (Von der Wartburg),uch br,C major,1857?,"Choral, secular",arr. of S.313; arr. for uch pf as S.87/8b
87/8b,L10b/2,Weimars Volkslied (Von der Wartburg),uch pf,C major,1857?,"Choral, secular",arr. of S.87/8a
88,M34b,Mit klingendem Spiel I (Morgenlied),fch,,1859,"Choral, secular",alternative text to S.89
89,M34a,Mit klingendem Spiel II (Morgenlied),cch,,1859,"Choral, secular",alternative text to S.88
90/1a,M31/1,"Vereins-Lied (Frisch auf, zu neuem Leben)",mch,,1855,"Choral, secular","1st version of S.90/1b, S.90/1c"
90/1b,M31/2,"Vereins-Lied (Frisch auf, zu neuem Leben)",mch,,1857,"Choral, secular","2nd version of S.90/1a, S.90/1c"
90/1c,M31/3,"Vereins-Lied (Frisch auf, zu neuem Leben)",mch,,1860,"Choral, secular","No.1 of Für Männergesang; 3rd version of S.90/1a, S.90/1b"
90/2a,M7/1,"Ständchen (Hüttelein, still und klein)",ten mch,A major,1841–43?,"Choral, secular","1st version of S.90/2b, S.90/2c"
90/2b,M7/2,"Ständchen (Hüttelein, still und klein)",ten mch,A major,1845–49?,"Choral, secular","No.6 of Sechs Männerchöre; 2nd version of S.90/2a, S.90/2c"
90/2c,M7/3,"Ständchen (Hüttelein, still und klein)",ten mch,G major,1857–60,"Choral, secular","No.2 of Für Männergesang; 3rd version of S.90/2a, S.90/2b"
90/3a,M10/1,Wir sind nicht Mumien,mch pf,,1842,"Choral, secular",No.1 of Vierstimmige Männergesänge; 1st version of S.90/3b
90/3b,M10/2,Wir sind nicht Mumien,mch pf,,1860–61,"Choral, secular",No.3 of Für Männergesang; 2nd version of S.90/3a
90/4a,M22/1,Vor der Schlacht (Es rufet Gott uns mahnend),mch pf,,1845,"Choral, secular",1st version of S.90/4b; arr. for pf as S.511/1
90/4b,M22/2,Vor der Schlacht (Es rufet Gott uns mahnend),mch,,1860,"Choral, secular",No.4 of Für Männergesang; 2nd version of S.90/4a
90/5a,M23/1,Nicht gezagt,mch pf,A? major,1845,"Choral, secular",1st version of S.90/5b; arr. for pf as S.511/2
90/5b,M23/2,Nicht gezagt,mch,G major,1860,"Choral, secular",No.5 of Für Männergesang; 2nd version of S.90/5a
90/6a,M24/1,Es rufet Got,mch pf,,1845,"Choral, secular",1st version of S.90/6b; arr. for pf as S.511/3
90/6b,M24/2,Es rufet Got,mch,,1860,"Choral, secular",No.6 of Für Männergesang; 2nd version of S.90/6a
90/7a,M18/1,Soldatenlied aus Faust (Burgen mit hohen Mauern und Zinnen),mch (+tpt timp),,1844,"Choral, secular",No.5 of Sechs Männerchöre; 1st version of S.90/7b
90/7b,M18/2,Soldatenlied aus Faust (Burgen mit hohen Mauern und Zinnen),mch (+tpt timp),,1860–61,"Choral, secular",No.7 of Für Männergesang; 2nd version of S.90/7a
90/8a,M9/1,Die alten Sagen kunden,mch pf,B? major,1841–45?,"Choral, secular",No.2 of Sechs Männerchöre; 1st version of S.90/8b
90/8b,M9/2,Die alten Sagen kunden,4vv mch,A minor,1860–61,"Choral, secular",No.8 of Für Männergesang; 2nd version of S.90/8a
90/9a,M8/1,Saatengrün,mch pf/(hp?),,1843?,"Choral, secular",No.3 of Sechs Männerchöre; 1st version of S.90/9b
90/9b,M8/2,Saatengrün,mch,A major,1860–61,"Choral, secular",No.9 of Für Männergesang; 2nd version of S.90/9a
90/10a,M6/1,Der Gang um Mitternacht (Ich schreite mit dem Geist),mch,,1841–43?,"Choral, secular",No.4 of Sechs Männerchöre; 1st version of S.90/10b
90/10b,M6/2,Der Gang um Mitternacht (Ich schreite mit dem Geist),ten mch,,1860,"Choral, secular",No.10 of Für Männergesang; 2nd version of S.90/10a
90/11a,M35/1,Festlied zu Schillers Jubelfeier 10 November 1859,bar mch,,1859,"Choral, secular",1st version of S.90/11b
90/11b,M35/2,Festlied zu Schillers Jubelfeier 10 November 1859,bar mch,,1860,"Choral, secular",No.11 of Für Männergesang; 2nd version of S.90/11a
90/12a,M13/1,Gottes ist der Orient,mch,B major,1842,"Choral, secular",No.4 of Vierstimmige Männergesänge; 1st version of S.90/12b
90/12b,M13/2,Gottes ist der Orient,mch,A major,1860–61,"Choral, secular",No.12 of Für Männergesang; 2nd version of S.90/12a
